{
  "$defs": {
    "numerical_value": {
      "additionalProperties": false,
      "properties": {
        "basis": {
          "type": [
            "string",
            "null"
          ]
        },
        "origin": {
          "type": "string"
        },
        "status": {
          "type": "string"
        },
        "uncertainty": {
          "type": [
            "object",
            "null"
          ]
        },
        "unit": {
          "type": [
            "string",
            "null"
          ]
        },
        "value": {
          "type": [
            "number",
            "integer",
            "null"
          ]
        },
        "warning": {
          "type": [
            "string",
            "null"
          ]
        }
      },
      "required": [
        "value",
        "unit",
        "basis",
        "status",
        "origin",
        "warning",
        "uncertainty"
      ],
      "type": "object"
    }
  },
  "$id": "process_graph_schema.json",
  "$schema": "https://json-schema.org/draft/2020-12/schema",
  "additionalProperties": false,
  "properties": {
    "edges": {
      "items": {
        "properties": {
          "active": {
            "type": "boolean"
          },
          "classification": {
            "type": "string"
          },
          "edge_id": {
            "type": "string"
          },
          "mass_flow": {
            "$ref": "#/$defs/numerical_value"
          },
          "phase": {
            "type": "string"
          },
          "principal_components": {
            "items": {
              "type": "string"
            },
            "type": "array"
          },
          "source_node": {
            "type": [
              "string",
              "null"
            ]
          },
          "stream_id": {
            "type": "string"
          },
          "target_node": {
            "type": [
              "string",
              "null"
            ]
          },
          "warnings": {
            "items": {
              "type": "string"
            },
            "type": "array"
          }
        },
        "required": [
          "edge_id",
          "stream_id",
          "source_node",
          "target_node",
          "mass_flow",
          "phase",
          "active"
        ],
        "type": "object"
      },
      "type": "array"
    },
    "nodes": {
      "items": {
        "properties": {
          "active": {
            "type": "boolean"
          },
          "calculation_mode": {
            "type": "string"
          },
          "dashboard_group": {
            "type": "string"
          },
          "display_name": {
            "type": "string"
          },
          "key_kpis": {
            "type": "object"
          },
          "model_maturity": {
            "type": "string"
          },
          "node_id": {
            "type": "string"
          },
          "process_area": {
            "type": "string"
          },
          "technology": {
            "type": [
              "string",
              "null"
            ]
          },
          "unit_id": {
            "type": "string"
          },
          "warning_count": {
            "minimum": 0,
            "type": "integer"
          }
        },
        "required": [
          "node_id",
          "unit_id",
          "display_name",
          "process_area",
          "active",
          "calculation_mode"
        ],
        "type": "object"
      },
      "type": "array"
    },
    "run_id": {
      "type": "string"
    },
    "schema_version": {
      "const": "1.0.0"
    }
  },
  "required": [
    "schema_version",
    "run_id",
    "nodes",
    "edges"
  ],
  "title": "GreenHub ProcessGraph",
  "type": "object"
}
