{
  "edges": [
    {
      "active": true,
      "classification": "process",
      "edge_id": "stream:acid_solution",
      "mass_flow": {
        "basis": "stream total",
        "origin": "BioSTEAM stream",
        "status": "calculated",
        "uncertainty": null,
        "unit": "kg/hr",
        "value": 1.1538393901209678,
        "warning": null
      },
      "phase": "l",
      "principal_components": [
        "Water",
        "HydrochloricAcid"
      ],
      "source_node": null,
      "stream_id": "acid_solution",
      "target_node": "unit:M401",
      "warnings": []
    },
    {
      "active": true,
      "classification": "process",
      "edge_id": "stream:acidified_protein_liquid",
      "mass_flow": {
        "basis": "stream total",
        "origin": "BioSTEAM stream",
        "status": "calculated",
        "uncertainty": null,
        "unit": "kg/hr",
        "value": 247.30624261592743,
        "warning": null
      },
      "phase": "l",
      "principal_components": [
        "Water",
        "SolubleProtein",
        "Glucose",
        "Lipids",
        "NonBiodegradableOrganics"
      ],
      "source_node": "unit:M401",
      "stream_id": "acidified_protein_liquid",
      "target_node": "unit:R401",
      "warnings": []
    },
    {
      "active": true,
      "classification": "process",
      "edge_id": "stream:ammonia_polished_biogas",
      "mass_flow": {
        "basis": "stream total",
        "origin": "BioSTEAM stream",
        "status": "calculated",
        "uncertainty": null,
        "unit": "kg/hr",
        "value": 2.125967151506997,
        "warning": null
      },
      "phase": "g",
      "principal_components": [
        "CarbonDioxide",
        "Methane",
        "Water",
        "HydrogenSulfide",
        "Ammonia"
      ],
      "source_node": "unit:R602",
      "stream_id": "ammonia_polished_biogas",
      "target_node": "unit:F601",
      "warnings": []
    },
    {
      "active": true,
      "classification": "process",
      "edge_id": "stream:ammonia_scrubber_acid_solution",
      "mass_flow": {
        "basis": "stream total",
        "origin": "BioSTEAM stream",
        "status": "calculated",
        "uncertainty": null,
        "unit": "kg/hr",
        "value": 0.0,
        "warning": null
      },
      "phase": "l",
      "principal_components": [],
      "source_node": null,
      "stream_id": "ammonia_scrubber_acid_solution",
      "target_node": "unit:R602",
      "warnings": []
    },
    {
      "active": true,
      "classification": "process",
      "edge_id": "stream:ammonia_scrubber_liquor",
      "mass_flow": {
        "basis": "stream total",
        "origin": "BioSTEAM stream",
        "status": "calculated",
        "uncertainty": null,
        "unit": "kg/hr",
        "value": 0.35409035234375424,
        "warning": null
      },
      "phase": "l",
      "principal_components": [
        "Water",
        "CarbonDioxide",
        "Methane",
        "Ammonia",
        "HydrogenSulfide"
      ],
      "source_node": "unit:R602",
      "stream_id": "ammonia_scrubber_liquor",
      "target_node": "unit:M606",
      "warnings": []
    },
    {
      "active": true,
      "classification": "process",
      "edge_id": "stream:ammonia_scrubber_water",
      "mass_flow": {
        "basis": "stream total",
        "origin": "BioSTEAM stream",
        "status": "calculated",
        "uncertainty": null,
        "unit": "kg/hr",
        "value": 0.35081945514799023,
        "warning": null
      },
      "phase": "l",
      "principal_components": [
        "Water"
      ],
      "source_node": null,
      "stream_id": "ammonia_scrubber_water",
      "target_node": "unit:R602",
      "warnings": []
    },
    {
      "active": true,
      "classification": "process",
      "edge_id": "stream:base_solution",
      "mass_flow": {
        "basis": "stream total",
        "origin": "BioSTEAM stream",
        "status": "calculated",
        "uncertainty": null,
        "unit": "kg/hr",
        "value": 0.7952034240219958,
        "warning": null
      },
      "phase": "l",
      "principal_components": [
        "Water",
        "SodiumHydroxide"
      ],
      "source_node": null,
      "stream_id": "base_solution",
      "target_node": "unit:M403",
      "warnings": []
    },
    {
      "active": true,
      "classification": "product",
      "edge_id": "stream:water_scrubber_biomethane",
      "mass_flow": {
        "basis": "stream total",
        "origin": "BioSTEAM stream",
        "status": "calculated",
        "uncertainty": null,
        "unit": "kg/hr",
        "value": 0.8516381072857669,
        "warning": null
      },
      "phase": "g",
      "principal_components": [
        "Methane",
        "CarbonDioxide",
        "Water",
        "HydrogenSulfide",
        "Ammonia"
      ],
      "source_node": "unit:D611",
      "stream_id": "water_scrubber_biomethane",
      "target_node": null,
      "warnings": []
    },
    {
      "active": true,
      "classification": "process",
      "edge_id": "stream:centrifuge_flocculant",
      "mass_flow": {
        "basis": "stream total",
        "origin": "BioSTEAM stream",
        "status": "calculated",
        "uncertainty": null,
        "unit": "kg/hr",
        "value": 0.0,
        "warning": null
      },
      "phase": "l",
      "principal_components": [],
      "source_node": null,
      "stream_id": "centrifuge_flocculant",
      "target_node": "unit:C301",
      "warnings": []
    },
    {
      "active": true,
      "classification": "process",
      "edge_id": "stream:centrifuge_wash_water",
      "mass_flow": {
        "basis": "stream total",
        "origin": "BioSTEAM stream",
        "status": "calculated",
        "uncertainty": null,
        "unit": "kg/hr",
        "value": 0.0,
        "warning": null
      },
      "phase": "l",
      "principal_components": [],
      "source_node": null,
      "stream_id": "centrifuge_wash_water",
      "target_node": "unit:C301",
      "warnings": []
    },
    {
      "active": true,
      "classification": "process",
      "edge_id": "stream:clarified_protein_rich_liquid",
      "mass_flow": {
        "basis": "stream total",
        "origin": "BioSTEAM stream",
        "status": "calculated",
        "uncertainty": null,
        "unit": "kg/hr",
        "value": 246.15240322580647,
        "warning": null
      },
      "phase": "l",
      "principal_components": [
        "Water",
        "SolubleProtein",
        "Glucose",
        "Lipids",
        "NonBiodegradableOrganics"
      ],
      "source_node": "unit:C301",
      "stream_id": "clarified_protein_rich_liquid",
      "target_node": "unit:M401",
      "warnings": []
    },
    {
      "active": true,
      "classification": "process",
      "edge_id": "stream:conditioned_biogas",
      "mass_flow": {
        "basis": "stream total",
        "origin": "BioSTEAM stream",
        "status": "calculated",
        "uncertainty": null,
        "unit": "kg/hr",
        "value": 2.125967151506997,
        "warning": null
      },
      "phase": "g",
      "principal_components": [
        "CarbonDioxide",
        "Methane",
        "Water",
        "HydrogenSulfide",
        "Ammonia"
      ],
      "source_node": "unit:F601",
      "stream_id": "conditioned_biogas",
      "target_node": "unit:M610",
      "warnings": []
    },
    {
      "active": true,
      "classification": "process",
      "edge_id": "stream:conditioned_digester_feed",
      "mass_flow": {
        "basis": "stream total",
        "origin": "BioSTEAM stream",
        "status": "calculated",
        "uncertainty": null,
        "unit": "kg/hr",
        "value": 241.4049385097231,
        "warning": null
      },
      "phase": "l",
      "principal_components": [
        "Water",
        "SolubleProtein",
        "Glucose",
        "SodiumChloride",
        "Lipids"
      ],
      "source_node": "unit:M501",
      "stream_id": "conditioned_digester_feed",
      "target_node": "unit:H501",
      "warnings": []
    },
    {
      "active": true,
      "classification": "process",
      "edge_id": "stream:conditioned_protein_depleted_liquid",
      "mass_flow": {
        "basis": "stream total",
        "origin": "BioSTEAM stream",
        "status": "calculated",
        "uncertainty": null,
        "unit": "kg/hr",
        "value": 241.38080042968014,
        "warning": null
      },
      "phase": "l",
      "principal_components": [
        "Water",
        "SolubleProtein",
        "Glucose",
        "SodiumChloride",
        "Lipids"
      ],
      "source_node": "unit:M403",
      "stream_id": "conditioned_protein_depleted_liquid",
      "target_node": "unit:M501",
      "warnings": []
    },
    {
      "active": true,
      "classification": "process",
      "edge_id": "stream:conditioning_spent_material",
      "mass_flow": {
        "basis": "stream total",
        "origin": "BioSTEAM stream",
        "status": "calculated",
        "uncertainty": null,
        "unit": "kg/hr",
        "value": 0.024709687297823944,
        "warning": null
      },
      "phase": "s",
      "principal_components": [
        "ActivatedCarbon",
        "CapturedHydrogenSulfide"
      ],
      "source_node": "unit:M607",
      "stream_id": "conditioning_spent_material",
      "target_node": "unit:M699",
      "warnings": []
    },
    {
      "active": true,
      "classification": "residual",
      "edge_id": "stream:conditioning_wastewater",
      "mass_flow": {
        "basis": "stream total",
        "origin": "BioSTEAM stream",
        "status": "calculated",
        "uncertainty": null,
        "unit": "kg/hr",
        "value": 0.39035373090806375,
        "warning": null
      },
      "phase": "l",
      "principal_components": [
        "Water",
        "CarbonDioxide",
        "Methane",
        "Ammonia",
        "HydrogenSulfide"
      ],
      "source_node": "unit:M606",